{
  "schema_version": "2.1.0",
  "model_name": "test_model",
  "literature": {
    "title": "Test Paper Title",
    "year": 2024,
    "journal": "Journal of Chemical Information and Modeling",
    "doi": null,
    "volume": null,
    "issue": null,
    "data_linked": "yes",
    "code_linked": "yes",
    "training_set": "PDBbind v2016 refined",
    "casf_benchmark": {
      "year": 2016,
      "n_complexes": 285,
      "target": "pKd",
      "target_unit": null,
      "target_normalized": null
    },
    "reported_scoring_power": {
      "pearson_r": 0.85,
      "notes": null
    }
  },
  "artifacts": {
    "data_repo": null,
    "code_repo": {
      "availability_type": "github",
      "link": "https://github.com/test/testmodel",
      "license": "MIT",
      "last_commit_date": "2024-01-15",
      "has_readme": true,
      "readme_description": "TestModel readme description",
      "install_instructions": true,
      "explicit_versions": true,
      "environment_file": true,
      "install_script": false,
      "preprocessing_scripts": true,
      "inference_scripts": true,
      "training_scripts": true,
      "pretrained_weights": true,
      "notebook": false,
      "known_issues": null,
      "study_fork": null
    }
  },
  "environment": {
    "python_version": "3.9.13",
    "conda_env_name": "test_env",
    "conda_env_file": null,
    "cuda_toolkit": "11.3",
    "hardware": "MSU HPCC test-H100"
  },
  "reproducibility": {
    "status": "Fully reproduced",
    "troubleshooting_time": "<2h",
    "barriers_to_attempt": [],
    "failure_modes": [],
    "failure_notes": null,
    "reproduced_metrics": {
      "pearson_r": 0.84
    },
    "checkpoint_used": null
  }
}
